{
  "schema_version": 1,
  "id": "turn_rpg_training_rules",
  "name": "Turn RPG Training Rules",
  "version": "0.1.0",
  "description": "Sample GDScript runtime plugin that adjusts Turn RPG demo rules through hooks.",
  "implementation": {
    "type": "gdscript",
    "entry": "res://plugins/turn_rpg_training_rules/plugin.gd"
  },
  "capabilities": [
    "turn_rpg.rules",
    "battle.modifier"
  ],
  "hooks": {
    "turn_rpg.build_roster": {
      "priority": 100
    },
    "turn_rpg.battle_started": {
      "priority": 100
    },
    "turn_rpg.before_damage": {
      "priority": 100
    }
  },
  "config": {
    "party_hp_bonus": 8,
    "fireball_bonus_damage": 5
  }
}
